{
  "$schema": "http://json-schema.org/draft-06/schema#",
  "$ref": "#/definitions/Facilitator",
  "definitions": {
    "Address": {
      "type": "string",
      "pattern": "^0x[a-fA-F0-9]{40}$"
    },
    "Facilitator": {
      "type": "object",
      "additionalProperties": false,
      "properties": {
        "originChain": {
          "type": "string",
          "additionalProperties": false
        },
        "auxChainId": {
          "type": "number",
          "additionalProperties": false
        },
        "database": {
          "$ref": "#/definitions/Database"
        },
        "chains": {
          "type": "object",
          "additionalProperties": false,
          "patternProperties": {
            "^.{1,50}$": {
              "$ref": "#/definitions/Chain"
            }
          }
        },
        "encryptedAccounts": {
          "$ref": "#/definitions/EncryptedAccounts"
        }
      },
      "required": [
        "chains",
        "database",
        "encryptedAccounts",
        "originChain"
      ],
      "title": "Facilitator",
      "description": "Object encapsulating details about facilitator config"
    },
    "Chain": {
      "type": "object",
      "additionalProperties": false,
      "properties": {
        "worker": {
          "type": "string"
        },
        "nodeRpc": {
          "type": "string"
        },
        "subGraphWs":{
          "type": "string"
        },
        "subGraphRpc":{
          "type": "string"
        }
      },
      "required": [
        "worker",
        "nodeRpc",
        "subGraphWs",
        "subGraphRpc"
      ],
      "title": "Chain",
      "description": "It encapsulates chain specific information"
    },
    "Database": {
      "type": "object",
      "additionalProperties": false,
      "properties": {
        "path": {
          "type": "string"
        }
      },
      "required": [
        "path"
      ],
      "title": "Database",
      "description": "It represents database config details"
    },
    "EncryptedAccounts": {
      "type": "object",
      "additionalProperties": false,
      "title": "EncryptedAccounts",
      "minProperties": 2,
      "maxProperties": 2,
      "patternProperties": {
        "^0x[a-fA-F0-9]{40}$": {
          "$ref": "#/definitions/Account",
          "description": "Represents encrypted account for an address"
        }
      },
      "description": "List of encrypted accounts"
    },
    "Account": {
      "type": "object",
      "title": "Web3 encrypted account",
      "description": "Object represents encrypted web3 account"
    }
  }
}
